question,CONTEXTS,LABELS,MESHES,YEAR,reasoning_required_pred,reasoning_free_pred,answer,LONG_ANSWER,domain_idx,domain,dtype,intent
Does s100A4 siRNA inhibit human pancreatic cancer cell invasion in vitro?,"['Pancreatic cancer is one of the most deadly cancers, which is characterized by its high metastatic potential. S100A4 is a major prometastatic protein involved in tumor invasion and metastasis which precise role in pancreatic cancer has not been fully investigated. We knocked down the S100A4 gene in the Bxpc-3 pancreatic cancer cell line via RNA interference to study the changes in cell behavior.', 'Real-time polymerase chain reaction and western blotting were used to detect mRNA and protein expression levels of S100A4, matrix metalloproteinase (MMP)-2, E-cadherin and thrombospondin (TSP)-1. Transwell chambers were used to detect the migration and invasion abilities; a cell adhesion assay was used to detect adhesion ability; colony forming efficiency was used to detect cell proliferation; flow cytometry was used to detect apoptosis.', 'S100A4 mRNA expression was reduced to 17% after transfection with S100A4-siRNA, and protein expression had a similar trend. mRNA and protein expression of MMP-2 was reduced and that of E-cadherin and TSP-1 was elevated, indicating that S100A4 affects their expression. S100A4-silenced cells exhibited a marked decrease in migration and invasiveness and increased adhesion, whereas overall proliferation and apoptosis were not overtly altered.']","['OBJECTIVE', 'METHODS', 'RESULTS']","['Apoptosis', 'Blotting, Western', 'Cadherins', 'Cell Line, Tumor', 'Cell Proliferation', 'Humans', 'Matrix Metalloproteinase 2', 'Pancreatic Neoplasms', 'RNA Interference', 'RNA, Small Interfering', 'Real-Time Polymerase Chain Reaction', 'S100 Calcium-Binding Protein A4', 'S100 Proteins', 'Thrombospondin 1']",,,,yes,"S100A4 and its downstream factors play important roles in pancreatic cancer invasion, and silencing A100A4 can significantly contain the invasiveness of pancreatic cancer.",8,MEDICAL,Simple Datatype-Boolean,"Analytical/Evaluative (Convergent Thinking): This merged category is for queries that involve dissecting complex information or data to understand underlying patterns, reasons, or to make informed judgements. Queries in this category seek a deeper understanding that supports decision-making, comparison of options, or evaluating alternatives. The process involves both analysis (to break down and understand) and evaluation (to assess, compare, and decide), acknowledging that these processes often occur in tandem. This category involves queries where the goal is to converge upon a specific answer or decision through analysis and evaluation."
Does prevalence and correlate of intimate partner violence against HIV-seropositive pregnant women in a Nigerian population?,"['To evaluate the prevalence and correlates of intimate partner violence among HIV-positive pregnant Nigerian women.', 'Cross-sectional study using an anonymous semi-structured interviewer-administered questionnaire.', 'The antenatal clinic at the University of Benin Teaching Hospital, Nigeria, from June 2008 to December 2009.', '305 HIV-positive women receiving antenatal care.', 'An anonymous semi-structured World Health Organization modified questionnaire that elicited information on the experiences of intimate partner violence, was administered to the women by trained female interviewers.', 'Prevalence, pattern and risk factors associated with experiencing intimate partner violence.', 'The prevalence of intimate partner violence among the women was 32.5%, with psychological violence being the most common form of violence reported (27.5%) and physical violence the least reported (5.9%). Identified risk factors for experiencing violence were multiparity (Odds ratio 9.4; CI 1.23-71.33), respondents with an HIV-positive child (Odds ratio 9.2; CI 4.53-18.84), experience of violence before they were diagnosed HIV-positive (Odds ratio 44.4; 10.33-190.42) and women with partners without post-secondary education (Odds ratio 2.3; CI 1.40-3.91).']","['OBJECTIVE', 'METHODS', 'METHODS', 'METHODS', 'METHODS', 'METHODS', 'RESULTS']","['Adolescent', 'Adult', 'Battered Women', 'Cross-Sectional Studies', 'Educational Status', 'Female', 'HIV Seropositivity', 'Humans', 'Logistic Models', 'Nigeria', 'Odds Ratio', 'Parity', 'Pregnancy', 'Pregnancy Complications, Infectious', 'Pregnant Women', 'Prevalence', 'Risk Factors', 'Spouse Abuse', 'Surveys and Questionnaires']",,,,yes,"Intimate partner violence is a prevalent public health problem among HIV-infected pregnant women in our community and it may hinder efforts to scale up prevention of mother-child transmission programs, especially in developing countries. Screening for intimate partner violence to identify abused women should be incorporated into these programs to offer these women optimal care.",8,MEDICAL,Simple Datatype-String,"Analytical/Evaluative (Convergent Thinking): This merged category is for queries that involve dissecting complex information or data to understand underlying patterns, reasons, or to make informed judgements. Queries in this category seek a deeper understanding that supports decision-making, comparison of options, or evaluating alternatives. The process involves both analysis (to break down and understand) and evaluation (to assess, compare, and decide), acknowledging that these processes often occur in tandem. This category involves queries where the goal is to converge upon a specific answer or decision through analysis and evaluation."
Is gSK3beta involved in JNK2-mediated beta-catenin inhibition?,"['We have recently reported that mitogen-activated protein kinase (MAPK) JNK1 downregulates beta-catenin signaling and plays a critical role in regulating intestinal homeostasis and in suppressing tumor formation. This study was designed to determine whether JNK2, another MAPK, has similar and/or different functions in the regulation of beta-catenin signaling.', 'We used an in vitro system with manipulation of JNK2 and beta-catenin expression and found that activated JNK2 increased GSK3beta activity and inhibited beta-catenin expression and transcriptional activity. However, JNK2-mediated downregulation of beta-catenin was blocked by the proteasome inhibitor MG132 and GSK3beta inhibitor lithium chloride. Moreover, targeted mutations at GSK3beta phosphorylation sites (Ser33 and Ser37) of beta-catenin abrogated JNK2-mediated suppression of beta-catenin. In vivo studies further revealed that JNK2 deficiency led to upregulation of beta-catenin and increase of GSK3-beta phosphorylation in JNK2-/- mouse intestinal epithelial cells. Additionally, physical interaction and co-localization among JNK2, beta-catenin and GSK3beta were observed by immunoprecipitation, mammalian two-hybridization assay and confocal microscopy, respectively.']","['BACKGROUND', 'RESULTS']","['Animals', 'Blotting, Western', 'Cell Line', 'Cyclin-Dependent Kinase 4', 'Down-Regulation', 'Enzyme Inhibitors', 'Glycogen Synthase Kinase 3', 'Glycogen Synthase Kinase 3 beta', 'Humans', 'Immunoprecipitation', 'Leupeptins', 'Mice', 'Mice, Knockout', 'Mitogen-Activated Protein Kinase 9', 'Phosphorylation', 'Transcription, Genetic', 'Up-Regulation', 'beta Catenin']",,,,yes,"In general, our data suggested that JNK2, like JNK1, interacts with and suppresses beta-catenin signaling in vitro and in vivo, in which GSK3beta plays a key role, although previous studies have shown distinct functions of JNK1 and JNK2. Our study also provides a novel insight into the crosstalk between Wnt/beta-catenin and MAPK JNKs signaling.",0,SCIENCE,Simple Datatype-Boolean,"Informational: Encompasses seeking factual information, definitions, and explanations. This category is for queries that aim directly at understanding specific facts or data."
Is bladder neck mobility a heritable trait?,"['Congenital connective tissue dysfunction may partly be responsible for female pelvic organ prolapse and urinary incontinence. We undertook a heritability study to determine whether mobility of the bladder neck, one of the main determinants of stress urinary incontinence, is genetically influenced.', 'Heritability study using a twin model and structural equation modelling.', 'Queensland Institute of Medical Research, Brisbane, Australia.', 'One hundred and seventy-eight nulliparous Caucasian female twins and their sisters (46 monozygotic pairs, 24 dizygotic pairs and 38 sisters) aged 18-24 years.', 'We performed translabial ultrasound, supine and after bladder emptying, for pelvic organ mobility. Urethral rotation and bladder neck descent were calculated using the best of three effective Valsalva manoeuvres.', 'Bladder and urethral mobility on Valsalva assessed by urethral rotation, vertical and oblique bladder neck descent.', 'Genetic modelling indicated that additive genes accounted for up to 59% of the variance for bladder neck descent. All remaining variance appeared due to environmental influences unique to the individual, including measurement error.']","['OBJECTIVE', 'METHODS', 'METHODS', 'METHODS', 'METHODS', 'METHODS', 'RESULTS']","['Adolescent', 'Adult', 'Age Factors', 'Analysis of Variance', 'Environment', 'Female', 'Heredity', 'Humans', 'Movement', 'Pelvic Floor', 'Phenotype', 'Prolapse', 'Ultrasonography', 'Urethra', 'Urinary Bladder', 'Urinary Incontinence', 'Valsalva Maneuver']",,,,yes,A significant genetic contribution to the phenotype of bladder neck mobility appears likely.,8,MEDICAL,Simple Datatype-Boolean,"Analytical/Evaluative (Convergent Thinking): This merged category is for queries that involve dissecting complex information or data to understand underlying patterns, reasons, or to make informed judgements. Queries in this category seek a deeper understanding that supports decision-making, comparison of options, or evaluating alternatives. The process involves both analysis (to break down and understand) and evaluation (to assess, compare, and decide), acknowledging that these processes often occur in tandem. This category involves queries where the goal is to converge upon a specific answer or decision through analysis and evaluation."
Is adiponectin downregulation associated with volume overload-induced myocyte dysfunction in rats?,"['Adiponectin has been reported to exert protective effects during pathological ventricular remodeling, but the role of adiponectin in volume overload-induced heart failure remains unclear. In this study we investigated the effect of adiponectin on cardiac myocyte contractile dysfunction following volume overload in rats.', 'Volume overload was surgically induced in rats by infrarenal aorta-vena cava fistula. The rats were intravenously administered adenoviral adiponectin at 2-, 6- and 9-weeks following fistula. The protein expression of adiponectin, adiponectin receptors (AdipoR1/R2 and T-cadherin) and AMPK activity were measured using Western blot analyses. Isolated ventricular myocytes were prepared at 12 weeks post-fistula to examine the contractile performance of myocytes and intracellular Ca(2+) transient.', 'A-V fistula resulted in significant reductions in serum and myocardial adiponectin levels, myocardial adiponectin receptor (AdipoR1/R2 and T-cadherin) levels, as well as myocardial AMPK activity. Consistent with these changes, the isolated myocytes exhibited significant depression in cell shortening and intracellular Ca(2+) transient. Administration of adenoviral adiponectin significantly increased serum adiponectin levels and prevented myocyte contractile dysfunction in fistula rats. Furthermore, pretreatment of isolated myocytes with recombinant adiponectin (2.5 μg/mL) significantly improved their contractile performance in fistula rats, but had no effects in control or adenoviral adiponectin-administered rats.']","['OBJECTIVE', 'METHODS', 'RESULTS']","['AMP-Activated Protein Kinases', 'Adiponectin', 'Animals', 'Calcium', 'Cells, Cultured', 'Down-Regulation', 'Heart Failure', 'Male', 'Myocytes, Cardiac', 'Rats', 'Rats, Sprague-Dawley']",,,,yes,These results demonstrate a positive correlation between adiponectin downregulation and volume overload-induced ventricular remodeling. Adiponectin plays a protective role in volume overload-induced heart failure.,0,SCIENCE,Simple Datatype-Boolean,"Analytical/Evaluative (Convergent Thinking): This merged category is for queries that involve dissecting complex information or data to understand underlying patterns, reasons, or to make informed judgements. Queries in this category seek a deeper understanding that supports decision-making, comparison of options, or evaluating alternatives. The process involves both analysis (to break down and understand) and evaluation (to assess, compare, and decide), acknowledging that these processes often occur in tandem. This category involves queries where the goal is to converge upon a specific answer or decision through analysis and evaluation."
"Is the functional intraoperative pulmonary blood flow study a more sensitive predictor than preoperative anatomy for right ventricular pressure and physiologic tolerance of ventricular septal defect closure after complete unifocalization in patients with pulmonary atresia , ventricular septal defect , and major aortopulmonary collaterals?","['The objective was to determine if intraoperative pulmonary artery (PA) flow studies after complete unifocalization correlate with postrepair hemodynamics for pulmonary atresia (PA), ventricular septal defects (VSD), and major aortopulmonary collaterals.', 'Twenty patients (median age, 8 months; weight, 7.9 kg) underwent unifocalization between 2003 and 2008. A functional PA flow study was achieved by cannulating the unifocalized central PA before intracardiac repair and increasing flow incrementally to 2.5 L/min per m(2). Mean PA pressure (mPAP) was measured. The intent was to close the VSD for a mPAP of <30 mm Hg. Right ventricular systolic pressure (RVSP) and systemic systolic pressure were recorded. Total incorporated pulmonary segments, pulmonary segment artery ratio (ratio of incorporated segments to 18), and total neopulmonary artery index (the sum of major aortopulmonary collaterals and native PA index) were calculated. The VSD was successfully closed in 18 patients (90%). One attempted closure required an intraoperative fenestration. The study mPAP correlated with RVSP (rho=0.72; P=0.0027) and RVSP/systemic systolic pressure (rho=0.67; P=0.0063). Total neopulmonary artery index had a nonsignificant negative correlation with RVSP (rho=-0.42; P=0.079). Total incorporated pulmonary segments and pulmonary segment artery ratio were not correlated. Flow study mPAP had the highest accuracy in predicting successful VSD closure: area under the receiver-operator curve (0.83) versus total neopulmonary artery index (0.42), pulmonary segments (0.35), and pulmonary segment artery ratio (0.33).']","['BACKGROUND', 'RESULTS']","['Adolescent', 'Child', 'Child, Preschool', 'Collateral Circulation', 'Female', 'Follow-Up Studies', 'Heart Septal Defects, Ventricular', 'Humans', 'Infant', 'Magnetic Resonance Imaging', 'Male', 'Pulmonary Artery', 'Pulmonary Atresia', 'Pulmonary Circulation', 'Systole', 'Ventricular Function, Right']",,,,yes,The intraoperative pulmonary flow study predicted postoperative physiology significantly better than did standard anatomic measures. Conventional measures should be used with caution when determining the possibility for complete repair.,8,MEDICAL,Simple Datatype-Boolean,"Analytical/Evaluative (Convergent Thinking): This merged category is for queries that involve dissecting complex information or data to understand underlying patterns, reasons, or to make informed judgements. Queries in this category seek a deeper understanding that supports decision-making, comparison of options, or evaluating alternatives. The process involves both analysis (to break down and understand) and evaluation (to assess, compare, and decide), acknowledging that these processes often occur in tandem. This category involves queries where the goal is to converge upon a specific answer or decision through analysis and evaluation."
Does inhibiting CB1 receptors improve lipogenesis in an in vitro non-alcoholic fatty liver disease model?,"['The endocannabinoids system (ECs) mediated mainly by CB1 and CB2 receptors plays an important role in non-alcoholic fatty liver disease by regulating lipid metabolism. This study is to further investigate the expression of CB1 and CB2 in the fat accumulation liver cells and to identify possible underlying mechanism by detecting the key lipogenesis factors.', ""Sodium oleate and sodium palmitate were added into the HepG2 cell line for forming fat accumulation liver cell. MTT assay was used to test the cell's cytotoxicity. The accumulation rate of fat in HepG2 cell was analyzed by the fluorescent staining. The mRNA and protein expression levels of CB1, CB2, SREBP-1c, ChREBP, L-PK, ACC1, FAS, LXRs and RXR were detected by RT-PCR and Western blot before and after the use of the antagonist."", 'The receptors of CB1 were expressed in HepG2 cells with low levels while in HepG2 fatty liver cells with higher levels (p\u2009<\u20090.05). However, after the application of antagonist, the expressions were significantly decreased (p\u2009<\u20090.05). The expressions of SREBP-1c, ChREBP and LXRs were detectable in HepG2 cells and the expressions were increased in HepG2 fatty liver cells (p\u2009<\u20090.05). After using the antagonists, the expressions of SREBP-1c, ChREBP, LXRs, ACC1 and FAS were significantly decreased (p\u2009<\u20090.05). But L-PK and RXR changed little in two groups (p\u2009>\u20090.05).']","['BACKGROUND', 'METHODS', 'RESULTS']","['Cannabinoid Receptor Antagonists', 'Drug Evaluation, Preclinical', 'Hep G2 Cells', 'Humans', 'Lipogenesis', 'Non-alcoholic Fatty Liver Disease', 'Piperidines', 'Pyrazoles', 'Receptor, Cannabinoid, CB1', 'Receptor, Cannabinoid, CB2', 'Rimonabant']",,,,yes,"Results of the present study demonstrated that CB1 receptors had important pathophysiological effects on the formation of fatty liver. CB1 receptors could be regulated by SREBP-1c, ChREBP and LXRs. Therefore, targeting CB1 receptors for the treatment of NAFLD might have a potential application value.",0,SCIENCE,Simple Datatype-Boolean,"Analytical/Evaluative (Convergent Thinking): This merged category is for queries that involve dissecting complex information or data to understand underlying patterns, reasons, or to make informed judgements. Queries in this category seek a deeper understanding that supports decision-making, comparison of options, or evaluating alternatives. The process involves both analysis (to break down and understand) and evaluation (to assess, compare, and decide), acknowledging that these processes often occur in tandem. This category involves queries where the goal is to converge upon a specific answer or decision through analysis and evaluation."
Are pioglitazone and metformin equally effective in reduction of chemerin in patients with type 2 diabetes?,"['Chemerin, a novel member of the family of adipocytokines, has been shown to be associated with insulin resistance, as well as micro- and macrovascular complications of diabetes. We investigated the effects of pioglitazone and metformin, two commonly prescribed antidiabetic agents, on the reduction of serum chemerin concentrations.', 'In an open-labeled randomized clinical trial, 81 patients with newly diagnosed type\xa02 diabetes who were not taking antidiabetic medications were recruited. Patients were randomly assigned to either pioglitazone 30\xa0mg daily or metformin 1,000\xa0mg daily. Serum chemerin concentrations, indices of glycemic control, serum lipids concentrations, and anthropometric parameters were measured at baseline and after 3\xa0months.', ""Pioglitazone and metformin did not alter waist circumference, weight or body mass index after 3\xa0months. In contrast, all indices of glycemia and insulin resistance improved substantially after 3\xa0months' treatment with both medications (P\xa0<\xa00.01 in all analyses). There was a significant decrease in chemerin concentrations after 3\xa0months in the pioglitazone group (P\xa0=\xa00.008). Similarly, metformin caused a significant drop in chemerin concentrations at week\xa012 (P\xa0=\xa00.015). When compared, metformin and pioglitazone proved to be equally effective in the alleviation of chemerin concentrations (P\xa0=\xa00.895, effect size: 0.1%).""]","['OBJECTIVE', 'METHODS', 'RESULTS']",[],,,,yes,"The present findings show that pioglitazone and metformin have comparable efficacy on serum chemerin concentrations, albeit through different mechanisms. Future studies need to focus on the clinical implications of lowered chemerin concentration on improvement of diabetes complications. This trial was registered with ClinicalTrials.gov (no. NCT01593371).",8,MEDICAL,Simple Datatype-Boolean,"Analytical/Evaluative (Convergent Thinking): This merged category is for queries that involve dissecting complex information or data to understand underlying patterns, reasons, or to make informed judgements. Queries in this category seek a deeper understanding that supports decision-making, comparison of options, or evaluating alternatives. The process involves both analysis (to break down and understand) and evaluation (to assess, compare, and decide), acknowledging that these processes often occur in tandem. This category involves queries where the goal is to converge upon a specific answer or decision through analysis and evaluation."
Is tumour burden an independent prognostic factor in metastatic renal cell carcinoma?,"[""Study Type--Prognosis (cohort series) Level of Evidence 2b. What's known on the subject? and What does the study add? In the literature, few studies have evaluated the role of tumour burden (TB) in metastatic real cell carcinoma (mRCC), even though it has been considered as important in localized tumours. In metastatic patients the role of TB is uncertain because it was analyzed in chemotherapy treated patients or using a partial evaluation of TB. This study, first reports the independent prognostic and predictive role of TB in mRCC patients treated with targeted agents in prospective clinical trials. TB is able to predict prognosis independently to localization of metastases and prognostic class defined by MSKCC criteria, moreover it is strictly related to patient's performance status."", '• To investigate the possible prognostic role of baseline tumour burden (TB) in terms of progression-free survival (PFS) and overall survival (OS), in patients with metastatic renal cell carcinoma (mRCC).', '• A homogenous group of patients with mRCC enrolled in second-line trials post-cytokine treatment were selected for the present analysis. • The Response Evaluation Criteria in Solid Tumors (the sum of the longest unidimensional diameter of each target lesion) were used to assess TB. • The PFS and OS rates were estimated using the Kaplan-Meier method and compared across the groups using the log-rank test. • The association between TB and PFS or OS was evaluated using a Cox proportional hazards model. Multivariable analyses were adjusted for other prognostic variables: the Memorial Sloan Kettering Cancer Centre (MSKCC) risk class and treatment.', '• A total of 124 patients were included in the final analysis. Of these, 66% received sorafenib or sunitinib and 34% received placebo. The median follow-up was 80.1 month. • TB was directly related to PFS and OS and these associations remained significant after adjusting for modified MSKCC risk class and treatment,. • Each 1-cm increase in TB increased the risk of progression by 4.5% (hazard ratio [HR]: 1.05; 95% confidence interval [CI] 1.02-1.07; P < 0.001) and the risk of death by 5% (HR: 1.05; 95% CI 1.03-1.08; P < 0.001).']","['UNLABELLED', 'OBJECTIVE', 'METHODS', 'RESULTS']","['Aged', 'Angiogenesis Inhibitors', 'Antineoplastic Agents', 'Benzenesulfonates', 'Carcinoma, Renal Cell', 'Disease-Free Survival', 'Female', 'Humans', 'Indoles', 'Kidney Neoplasms', 'Male', 'Middle Aged', 'Niacinamide', 'Phenylurea Compounds', 'Prospective Studies', 'Pyridines', 'Pyrroles', 'Sorafenib', 'Sunitinib', 'Treatment Outcome', 'Tumor Burden']",,,,yes,• TB is easy to calculate from standard computed tomography and significantly relates to OS in patients with mRCC. • We report for the first time the independent prognostic role of baseline TB in multivariate analysis. •  We believe that this information could be translated into clinical practice.,8,MEDICAL,Simple Datatype-Boolean,"Analytical/Evaluative (Convergent Thinking): This merged category is for queries that involve dissecting complex information or data to understand underlying patterns, reasons, or to make informed judgements. Queries in this category seek a deeper understanding that supports decision-making, comparison of options, or evaluating alternatives. The process involves both analysis (to break down and understand) and evaluation (to assess, compare, and decide), acknowledging that these processes often occur in tandem. This category involves queries where the goal is to converge upon a specific answer or decision through analysis and evaluation."
