question,CONTEXTS,LABELS,MESHES,YEAR,reasoning_required_pred,reasoning_free_pred,answer,LONG_ANSWER,domain_idx,domain,dtype,intent
Are sexually assaulted victims getting younger?,"['From the clinical forensic examination reports produced by the Department of Forensic Medicine, Department of Forensic Medicine, Faculty of Health Sciences, University of Copenhagen, Denmark, in 2007 concerning rape, attempted rape and sexual assault (RAS), circumstances were extracted and analysed focussing on age, relationship, lesions, violence, location and alcohol intoxication.', 'A total of 184 girls and women over the age of 12 years were included in this retrospective study.', 'The median age of the victims was 20 years (range 12-89 years). 75.5% were under 30 years of age. 53% knew the perpetrator. More than one perpetrator was reported in 11%. 46% of the assaulted victims had a total number of 1-5 observed lesions and these were observed in all types of perpetrator relationship. Eight victims with more than 20 lesions were assaulted by a stranger or an acquaintance (first contact) (ACQ). 50% of the victims who had lesions were assaulted by a stranger or an ACQ. 55% of assaults occurred in private homes. A total of 107 had their blood alcohol concentration (BAC) measured. In all, 133 victims were assessed by the examining doctor to be unaffected by alcohol, eight of these had a BAC exceeding 1.0 per thousand. There was no correlation between the BAC and number of lesions. Two victims had a positive pregnancy test and were pregnant before the RAS.']","['BACKGROUND', 'METHODS', 'RESULTS']","['Adolescent', 'Adult', 'Aged', 'Aged, 80 and over', 'Alcohol Drinking', 'Child', 'Crime Victims', 'Denmark', 'Family', 'Female', 'Friends', 'Humans', 'Interpersonal Relations', 'Middle Aged', 'Rape', 'Retrospective Studies', 'Sex Offenses', 'Young Adult']",,,,yes,"In Denmark, RAS victims' age continues to decrease. RAS by a stranger or an ACQ involves a higher risk of lesions and the possibility of many lesions. More than half of those exposed to manual strangulation or other kinds of violence against the neck were assaulted by a stranger or an ACQ. Half of the women knew the perpetrator and the perpetrator was an ACQ in 26% of the cases.",8,MEDICAL,Simple Datatype-Boolean,"Analytical/Evaluative (Convergent Thinking): This merged category is for queries that involve dissecting complex information or data to understand underlying patterns, reasons, or to make informed judgements. Queries in this category seek a deeper understanding that supports decision-making, comparison of options, or evaluating alternatives. The process involves both analysis (to break down and understand) and evaluation (to assess, compare, and decide), acknowledging that these processes often occur in tandem. This category involves queries where the goal is to converge upon a specific answer or decision through analysis and evaluation."
Is disease activity related to acute response to vasodilator in pulmonary artery hypertension associated with systemic lupus erythematosus?,"['No previous study has been done on whether systemic lupus erythematosus (SLE) disease activity is related to the hemodynamics and right ventricular (RV) function in patients with SLE-associated pulmonary artery hypertension (SLE-APAH).', 'This study prospectively recruited 54 patients (mean age, 32.8±8.4 years; 92.6% female) with SLE-APAH, including 34 patients with SLE disease activity index (SLEDAI) <5 (low score) and 20 with SLEDAI ≥5 (high score). All patients underwent right heart catheterization and iloprost inhalation, and echocardiography was performed before and immediately after iloprost inhalation. There was no difference in baseline mean pulmonary artery pressure (mPAP) between the 2 groups; pulmonary vascular resistance (PVR) was significantly higher and cardiac index was significantly lower in the low-SLEDAI group. The patients with low SLEDAI had larger RV size and worse RV systolic function on echocardiography. After iloprost inhalation, the patients with low SLEDAI had a greater decrease in mPAP and PVR than those with high SLEDAI, while significantly increased RV systolic function was found only in the low-SLEDAI group.']","['BACKGROUND', 'RESULTS']","['Adult', 'Cardiac Catheterization', 'Cardiovascular Agents', 'Echocardiography', 'Female', 'Humans', 'Hypertension, Pulmonary', 'Iloprost', 'Lupus Erythematosus, Systemic', 'Male', 'Vascular Resistance', 'Vasodilation', 'Ventricular Function, Right']",,,,yes,"SLE activity is related to hemodynamics and RV function in SLE-APAH patients, and those with low SLEDAI might have better acute response to vasodilator inhalation.",8,MEDICAL,Simple Datatype-Boolean,"Analytical/Evaluative (Convergent Thinking): This merged category is for queries that involve dissecting complex information or data to understand underlying patterns, reasons, or to make informed judgements. Queries in this category seek a deeper understanding that supports decision-making, comparison of options, or evaluating alternatives. The process involves both analysis (to break down and understand) and evaluation (to assess, compare, and decide), acknowledging that these processes often occur in tandem. This category involves queries where the goal is to converge upon a specific answer or decision through analysis and evaluation."
Does vascular targeting agent Oxi4503 inhibit tumor growth in a colorectal liver metastases model?,"['Oxi4503 is a potent vascular targeting agent belonging to the family of combretastatins. These agents produce an acute reduction in tumor blood flow leading to tumor necrosis. Despite evidence of its efficacy in certain malignancies, the effect on colorectal liver metastases remains largely unknown. This study investigates the effect of Oxi4503 on colorectal liver metastases in a murine model.', 'The effect of a single dose of Oxi4503 on established tumors in a murine model of colorectal liver metastases was assessed following administration of 1-50 mg/kg Oxi4503. In addition, the effects of continuous, daily and intermittent dosing (1-5 mg/kg) on tumor necrosis and growth were studied by quantitative histological and stereological analysis. The effect of multiple dosing on long-term survival was also assessed using the Kaplan-Meier analysis. The microvascular effects of therapy were studied by scanning electron microscopy of microvascular resin casts.', 'A single dose of 5 or 50 mg/kg of Oxi4503 produced significant tumor necrosis compared to the controls. Subcutaneous continuous dosing infusion with Oxi4503 at 1 mg/kg/day reduced tumor growth compared to the controls, but was associated with marked systemic toxicity. Daily administration over 21 days was associated with significant mortality. Intermittent dosing of Oxi4503 (two doses, 3 days apart) produced the greatest reduction in tumor growth with minimal toxicity and conferred a significant survival advantage. Microvascular casts demonstrated significant disruption of tumor vessels.']","['OBJECTIVE', 'METHODS', 'RESULTS']","['Animals', 'Antineoplastic Agents', 'Cell Line, Tumor', 'Cell Proliferation', 'Colorectal Neoplasms', 'Diphosphates', 'Dose-Response Relationship, Drug', 'Drug Administration Schedule', 'Infusion Pumps, Implantable', 'Infusions, Parenteral', 'Injections, Intraperitoneal', 'Liver Neoplasms, Experimental', 'Male', 'Mice', 'Mice, Inbred CBA', 'Microcirculation', 'Necrosis', 'Regional Blood Flow', 'Stilbenes', 'Time Factors']",,,,yes,"A single dose of Oxi4503 produced significant necrosis and microvascular injury in colorectal liver metastases. Intermittent dosing with Oxi4503 produced the maximum reduction in tumor growth, minimal toxicity, and a significant improvement in survival. Oxi4503 is a potential anticancer agent. Further research into its mechanism of action and its synergistic use with other therapies is warranted.",0,SCIENCE,Simple Datatype-Boolean,"Informational: Encompasses seeking factual information, definitions, and explanations. This category is for queries that aim directly at understanding specific facts or data."
Are magnetic resonance imaging-based tumour perfusion parameters biomarkers predicting response after radiation to brain metastases?,"['To investigate whether early relative cerebral blood volume (rCBV), relative cerebral blood flow (rCBF) and permeability (Ktrans(2)) measurements may serve as magnetic resonance imaging (MRI) biomarkers of radiation response or progression for brain metastases.', 'Seventy brain metastases in 44 patients treated with either stereotactic radiosurgery or whole brain radiotherapy were imaged with dynamic susceptibility and dynamic contrast enhancement MRI at baseline, 1 week and 1 month after treatment. The final response status was determined according to volume criteria derived from a 1 year post-treatment MRI or last available follow-up MRI. Tumours were characterised as responders, non-responders, progressors and non-progressors and compared for Ktrans(2), rCBF and rCBV differences. Uni- and multivariate analysis evaluated factors associated with tumour response and progression at 1 week and 1 month. A generalised estimating equations (GEE) model accounted for multiple tumours per subject. Receiver operator characteristic (ROC) analysis identified optimal cut-off values, sensitivity and specificity for response or progression.', 'Tumour responders showed lower Ktrans(2) and reduced rCBF at 1 week (P\xa0<\xa00.05 each). Progressive disease showed lower rCBF and reduced rCBV at 1 month (P\xa0<\xa00.05 each). GEE and multivariate analysis revealed lower Ktrans(2) at 1 week, an absence of prior radiation predicted response. At 1 month only lower rCBV predicted progressive disease on GEE and multivariate analysis. Optimal cut-off points for Ktrans(2) and rCBV were 1.37 and 2.03 with sensitivity and specificity of 61.5 and 81.1% and 73.9 and 81.8%, respectively.']","['OBJECTIVE', 'METHODS', 'RESULTS']","['Aged', 'Biomarkers', 'Blood Volume', 'Brain Neoplasms', 'Cerebrovascular Circulation', 'Disease Progression', 'Female', 'Follow-Up Studies', 'Humans', 'Magnetic Resonance Imaging', 'Male', 'Middle Aged', 'Neoplasm Staging', 'Perfusion', 'Prognosis', 'Prospective Studies', 'Radiation Injuries', 'Radiosurgery', 'Radiotherapy']",,,,yes,"Lower Ktrans(2) at 1 week and rCBV at 1 month discriminated responders and progressive disease, respectively.",8,MEDICAL,Simple Datatype-Boolean,"Analytical/Evaluative (Convergent Thinking): This merged category is for queries that involve dissecting complex information or data to understand underlying patterns, reasons, or to make informed judgements. Queries in this category seek a deeper understanding that supports decision-making, comparison of options, or evaluating alternatives. The process involves both analysis (to break down and understand) and evaluation (to assess, compare, and decide), acknowledging that these processes often occur in tandem. This category involves queries where the goal is to converge upon a specific answer or decision through analysis and evaluation."
Does dUSP6 regulate drug sensitivity by modulating DNA damage response?,"['Dual specificity phosphatase 6 (DUSP6) is a member of a family of mitogen-activated protein kinase phosphatases that dephosphorylates and inhibits activated ERK1/2. Dual specificity phosphatase 6 is dynamically regulated in developmental and pathological conditions such as cancer.', 'Cancer cell lines were made deficient in DUSP6 by siRNA and shRNA silencing. Sensitivity to anti-EGFR and chemotherapeutic agents was determined in viability and apoptosis assays, and in xenografts established in SCID mice. Cellular effects of DUSP6 inactivation were analysed by proteomic methods, followed by analysis of markers of DNA damage response (DDR) and cell cycle.', 'We determined that depletion of DUSP6 reduced the viability of cancer cell lines and increased the cytotoxicity of EGFR and other targeted inhibitors, and cytotoxic agents, in vitro and in vivo. Subsequent phosphoproteomic analysis indicated DUSP6 depletion significantly activated CHEK2 and p38, which function in the DDR pathway, and elevated levels of phosphorylated H2AX, ATM, and CHEK2, for the first time identifying a role for DUSP6 in regulating DDR.']","['BACKGROUND', 'METHODS', 'RESULTS']","['Animals', 'Antineoplastic Agents', 'Apoptosis', 'Cell Line, Tumor', 'Cell Survival', 'Checkpoint Kinase 2', 'DNA Damage', 'Dual Specificity Phosphatase 6', 'ErbB Receptors', 'HEK293 Cells', 'Humans', 'In Situ Nick-End Labeling', 'MAP Kinase Signaling System', 'Mice', 'Mice, SCID', 'Phosphorylation', 'Protein-Serine-Threonine Kinases', 'Proteomics', 'Signal Transduction', 'Xenograft Model Antitumor Assays', 'p38 Mitogen-Activated Protein Kinases']",,,,yes,Our results provide a novel insight into the DUSP6 function in regulating genomic integrity and sensitivity to chemotherapy in cancer.,0,SCIENCE,Simple Datatype-Boolean,"Analytical/Evaluative (Convergent Thinking): This merged category is for queries that involve dissecting complex information or data to understand underlying patterns, reasons, or to make informed judgements. Queries in this category seek a deeper understanding that supports decision-making, comparison of options, or evaluating alternatives. The process involves both analysis (to break down and understand) and evaluation (to assess, compare, and decide), acknowledging that these processes often occur in tandem. This category involves queries where the goal is to converge upon a specific answer or decision through analysis and evaluation."
Do classification of facial diagnosis gloss in Chinese medicine based on different algorithms?,"['To design a face gloss classification model and to provide an automatic and quantitative approach for the diagnosis of Chinese medicine (CM) based on the face images.', 'To classify the face gloss images into two groups (gloss and non-gloss), feature extraction methods were applied to the original images. The original images were supposed to obtain a more ideal representation in which gloss information was better revealed in four color spaces [including red, green, blue (RGB), hue, saturation, value (HSV), Gray and Lab]. Principal component analysis (PCA), 2-dimensional PCA (2DPCA), 2-directional 2-dimensional PCA [(2D)', 'All the six feature extraction methods were useful in extracting information of face gloss, especially LDA, which had the best prediction accuracy in the 4 color spaces. The average accuracy of LDA in the Lab was 7%-10% higher than that of PCA, 2DPCA, (2D)']","['OBJECTIVE', 'METHODS', 'RESULTS']",[],,,,yes,A computer-assisted classifification model was designed to provide an automatic and quantitative approach for the gloss diagnosis of CM based on the face images.,8,MEDICAL,Simple Datatype-String,"Analytical/Evaluative (Convergent Thinking): This merged category is for queries that involve dissecting complex information or data to understand underlying patterns, reasons, or to make informed judgements. Queries in this category seek a deeper understanding that supports decision-making, comparison of options, or evaluating alternatives. The process involves both analysis (to break down and understand) and evaluation (to assess, compare, and decide), acknowledging that these processes often occur in tandem. This category involves queries where the goal is to converge upon a specific answer or decision through analysis and evaluation."
Does endoaortic Clamping Increase the Risk of Stroke in Minimal Access Mitral Valve Surgery : A Multicenter Experience?,"['Some controversy exists regarding the safety of endoaortic balloon clamping in minimal access isolated mitral valve surgery (MIMVS). The aim of this European multicenter study was to analyze the results in 10 experienced centers and compare the outcomes with published data.', 'The most recent 50 consecutive MIMVS cases from 10 European surgeons who had performed at least 100 procedures were prospectively collected and retrospectively analyzed. All procedures were performed through right minithoracotomy with femoral cannulation and endoaortic balloon occlusion. In-hospital and 30-day outcomes were studied. Mortality and stroke rates were compared with published median sternotomy and MIMVS outcomes.', 'Mean age was 63.2 ± 12.5 years, 289 (57.8%) were male, mean logistic European system for cardiac operative risk evaluation was 6.1 ± 6.2, and 53 (10.6%) procedures had cardiac reoperations. Concomitant procedures were performed in 126 (25.9%) cases. Three patients (0.6%) required conversion to full sternotomy. Ten patients (2.0%) necessitated endoaortic balloon clamping conversion (8 to external clamping), and re-exploration for bleeding was necessary in 24 (4.8%) cases. Mean aortic cross-clamp and cardiopulmonary bypass times were 85.6 ± 30.1 and 129.5 ± 40.2 min, respectively, and were significantly longer for concomitant procedures (p < 0.001). There were no aortic dissections and no deep venous thromboses. Operative mortality (none neurologic) and major stroke occurred in 7 (1.4%) and 4 (0.8%) patients, respectively. These rates compared favorably with the published literature on isolated primary mitral valve surgery (MVS) through sternotomy or minithoracotomy (mortality rates 0.2% to 11.6%, stroke rates 0.6% to 4.4%).']","['BACKGROUND', 'METHODS', 'RESULTS']","['Aged', 'Balloon Occlusion', 'Cardiac Surgical Procedures', 'Female', 'Heart Valve Diseases', 'Hospital Mortality', 'Humans', 'Male', 'Middle Aged', 'Minimally Invasive Surgical Procedures', 'Mitral Valve', 'Mitral Valve Annuloplasty', 'Postoperative Complications', 'Reoperation', 'Retrospective Studies', 'Stroke', 'Thoracotomy']",,,,no,"Once procedural proficiency is acquired, endoaortic balloon clamping in MIMVS is a safe and effective technique. Despite the fact that this patient cohort also includes combined and redo procedures, the observed mortality and stroke rate compared favorably with the existing literature on primary isolated mitral valve surgery irrespective of the approach.",0,SCIENCE,Simple Datatype-String,"Analytical/Evaluative (Convergent Thinking): This merged category is for queries that involve dissecting complex information or data to understand underlying patterns, reasons, or to make informed judgements. Queries in this category seek a deeper understanding that supports decision-making, comparison of options, or evaluating alternatives. The process involves both analysis (to break down and understand) and evaluation (to assess, compare, and decide), acknowledging that these processes often occur in tandem. This category involves queries where the goal is to converge upon a specific answer or decision through analysis and evaluation."
Are memory Impairment and Executive Dysfunction Associated with Inadequately Controlled Diabetes in Older Adults?,"['To assess the cross-sectional relationship of glycemic control to memory impairment and executive dysfunction in older adults with diabetes treated at an urban primary care center.', 'As part of a primary care-based cognitive screening program, we identified adults age 65 or older with a diagnosis of diabetes. Glycosylated hemoglobin level (HbA1c) was used to define diabetes as controlled (HbA1c <7) or inadequately controlled(HbA1c ≥ 7). Episodic memory was measured by quartile of free recall scores on the Free and Cued Selective Reminding Test. Executive function was measured using an ordinal composite score derived from animal fluency and months backward. These were the main predictors of diabetic control.', 'The 169 participants with diabetes had a median age of 74. The sample was 38% African American and 42% Latino. One hundred four (61%) had inadequately controlled diabetes. Memory impairment and executive dysfunction were independent predictors of diabetic control after adjusting for age and education. Binary logistic regression models indicated that the odds of inadequately controlled diabetes was higher for patients in the worst quartile of memory functioning compared to patients in higher quartiles of memory functioning (odds ratio = 6.4; 95% confidence interval: 2.3, 17.6). Any level of executive dysfunction increased the odds of inadequately controlled diabetes compared to patients in the best quintile of executive functioning (odds ratio = 3.6; 95% confidence interval: 1.58, 8.35).']","['OBJECTIVE', 'METHODS', 'RESULTS']",[],,,,yes,"Memory impairment and executive dysfunction were associated with inadequately controlled diabetes. Though causal inferences are not robust in a cross-sectional study, we suggest that cognitive dysfunction may interfere with diabetes management and that inadequate diabetic control may contribute to cognitive dysfunction.",8,MEDICAL,Simple Datatype-Boolean,"Analytical/Evaluative (Convergent Thinking): This merged category is for queries that involve dissecting complex information or data to understand underlying patterns, reasons, or to make informed judgements. Queries in this category seek a deeper understanding that supports decision-making, comparison of options, or evaluating alternatives. The process involves both analysis (to break down and understand) and evaluation (to assess, compare, and decide), acknowledging that these processes often occur in tandem. This category involves queries where the goal is to converge upon a specific answer or decision through analysis and evaluation."
Does tolerance of platelet concentrate treated with UVC-light only for pathogen reduction -- a phase I clinical trial?,"['The THERAFLEX UV-Platelets pathogen reduction system for platelet concentrates (PCs) operates with ultraviolet C light (UVC; 254 nm) only without addition of photosensitizers. This phase I study evaluated safety and tolerability of autologous UVC-irradiated PCs in healthy volunteers.', 'Eleven volunteers underwent two single (series 1 and 2) and one double apheresis (series 3). PCs were treated with UVC, stored for 48 h and retransfused in a dose-escalation scheme: 12·5, 25% and 50% of a PC (series 1); one complete PC (series 2); two PCs (series 3). Platelet counts, fibrinogen, activated partial thromboplastin time, prothrombin time, D-dimer, standard haematology, temperature, heart rate, blood pressure and clinical chemistry parameters were measured. One- and 24-h corrected count increments were determined in series 2 and 3. Platelet-specific antibodies were assessed before and at the end of the study.', 'Neither adverse reactions related to transfusions nor antibodies against UVC-treated platelets were observed. Corrected count increments did not differ between series 2 and 3.']","['BACKGROUND', 'METHODS', 'RESULTS']","['Adult', 'Blood Platelets', 'Fibrin Fibrinogen Degradation Products', 'Healthy Volunteers', 'Humans', 'Immunoglobulin E', 'Male', 'Partial Thromboplastin Time', 'Photosensitizing Agents', 'Platelet Count', 'Platelet Transfusion', 'Prothrombin Time', 'Ultraviolet Rays', 'Young Adult']",,,,yes,Repeated transfusions of autologous UVC-treated PCs were well tolerated and did not induce antibody responses in all volunteers studied. EudraCT No. 2010-023404-26.,8,MEDICAL,Simple Datatype-Boolean,"Analytical/Evaluative (Convergent Thinking): This merged category is for queries that involve dissecting complex information or data to understand underlying patterns, reasons, or to make informed judgements. Queries in this category seek a deeper understanding that supports decision-making, comparison of options, or evaluating alternatives. The process involves both analysis (to break down and understand) and evaluation (to assess, compare, and decide), acknowledging that these processes often occur in tandem. This category involves queries where the goal is to converge upon a specific answer or decision through analysis and evaluation."
