question,CONTEXTS,LABELS,MESHES,YEAR,reasoning_required_pred,reasoning_free_pred,answer,LONG_ANSWER,domain_idx,domain,dtype,intent
Does hypoxia-ischemia brain damage disrupt brain cholesterol homeostasis in neonatal rats?,"['The first 3 weeks of life is the peak time of oligodendrocytes development and also the critical period of cholesterol increasing dramatically in central nervous system in rats. Neonatal hypoxia-ischemia (HI) brain damage happening in this period may disturb the brain cholesterol balance as well as white matter development.', 'To test this hypothesis, postnatal day 7 (P7) Sprague-Dawley rats were subjected to HI insult. Cholesterol concentrations from brain and plasma were measured. White matter integrity was evaluated by densitometric analysis of myelin basic protein (MBP) immunostaining and electron microscopy. Brain TNF-alpha and IL-6 levels were also measured.', 'HI-induced brain cholesterol, but not the plasma cholesterol, levels decreased significantly during the first three days after HI compared with naïve and sham operated rats (p<0.05). Obvious hypomyelination was indicated by marked reductions in MBP immunostaining on both P10 and P14 (p<0.01) and less and thinner myelinated axons were detected on P21 by electron microscopy observation. High expressions of brain TNF-alpha and IL-6 12 h after HI (p<0.05) were also observed.']","['OBJECTIVE', 'METHODS', 'RESULTS']","['Age Factors', 'Analysis of Variance', 'Animals', 'Animals, Newborn', 'Brain', 'Cholesterol', 'Enzyme-Linked Immunosorbent Assay', 'Hypoxia-Ischemia, Brain', 'Interleukin-6', 'Microscopy, Electron, Transmission', 'Myelin Basic Protein', 'Rats', 'Rats, Sprague-Dawley', 'Tumor Necrosis Factor-alpha']",,,,yes,"The present work provides evidence that HI insult destroyed brain cholesterol homeostasis, which might be important in the molecular pathology of hypoxic-ischemic white matter injury. Proinflammatory cytokines insulting oligodendrocytes, may cause cholesterol unbalance. Furthermore, specific therapeutic interventions to maintain brain cholesterol balance may be effective for the recovery of white matter function.",0,SCIENCE,Simple Datatype-Boolean,"Informational: Encompasses seeking factual information, definitions, and explanations. This category is for queries that aim directly at understanding specific facts or data."
Do base excision repair defects invoke hypersensitivity to PARP inhibition?,"['PARP-1 is important for the recognition of both endogenous and exogenous DNA damage, and binds to DNA strand breaks including intermediates of base excision repair (BER). Once DNA-bound, PARP-1 becomes catalytically activated synthesizing PAR polymers onto itself and other repair factors (PARylation). As a result, BER repair proteins such as XRCC1 and DNA polymerase β (pol β) are more efficiently and rapidly recruited to sites of DNA damage. In the presence of an inhibitor of PARP activity (PARPi), PARP-1 binds to sites of DNA damage, but PARylation is prevented. BER enzyme recruitment is hindered, but binding of PARP-1 to DNA is stabilized, impeding DNA repair and leading to double-strand DNA breaks (DSB). Deficiencies in pol β(-/-) and Xrcc1(-/-) cells resulted in hypersensitivity to the PARP inhibitor 4-AN and reexpression of pol β or XRCC1, in these contexts, reversed the 4-AN hypersensitivity phenotype. BER deficiencies also showed evidence of replication defects that lead to DSB-induced apoptosis upon PARPi treatment. Finally, the clinically relevant PARP inhibitors olaparib and veliparib also exhibited hypersensitivity in both pol β(-/-) and Xrcc1(-/-) BER-deficient cells. These results reveal heightened sensitivity to PARPi as a function of BER deficiency.']",['UNLABELLED'],"['Animals', 'Cell Line', 'DNA', 'DNA Breaks, Double-Stranded', 'DNA Damage', 'DNA Repair', 'DNA-Binding Proteins', 'Enzyme Inhibitors', 'Mice', 'Poly(ADP-ribose) Polymerase Inhibitors', 'Poly(ADP-ribose) Polymerases', 'X-ray Repair Cross Complementing Protein 1']",,,,yes,BER deficiency represents a new therapeutic opportunity to enhance PARPi efficacy.,8,MEDICAL,Simple Datatype-Boolean,"Analytical/Evaluative (Convergent Thinking): This merged category is for queries that involve dissecting complex information or data to understand underlying patterns, reasons, or to make informed judgements. Queries in this category seek a deeper understanding that supports decision-making, comparison of options, or evaluating alternatives. The process involves both analysis (to break down and understand) and evaluation (to assess, compare, and decide), acknowledging that these processes often occur in tandem. This category involves queries where the goal is to converge upon a specific answer or decision through analysis and evaluation."
Is hypertension after pediatric heart transplantation primarily associated with immunosuppressive regimen?,"['Hypertension is recognized as prevalent in pediatric cardiac transplant recipients. This study investigated risk factors for this complication and, in particular, the role of immunosuppression.', 'Results of 24-hour ambulatory blood pressure monitoring of children surviving more than 1 year after cardiac transplantation were analyzed retrospectively. Subjects were designated either hypertensive or normotensive by comparison with published normal values. To identify factors associated with hypertension, clinical data contemporaneous with 24-hour ambulatory blood pressure monitoring were collected and compared between the groups.', 'In the 51 children studied, the incidence of hypertension was 49%. Hypertensive and normotensive recipients were similar for sex, age at transplantation, time between transplantation and 24-hour ambulatory blood pressure results, and choice of calcineurin inhibitor. In contrast, hypertensive patients were taking significantly more immunosuppressive agents (2.92 vs 2.12 p < 0.01), had higher tacrolimus levels (10 vs 8.1 microg/liter, p = 0.03), and were more likely to be on maintenance prednisone therapy (64% vs 23%, p < 0.01) or regimens including sirolimus (40% vs 12%, p = 0.03). Multiple regression analysis controlling for tacrolimus level showed a combination of prednisone and sirolimus was more strongly associated with hypertension than either agent alone, with an odds ratio of 7.3 (95% confidence interval, 1.5-36.1) vs 4.1 (95% confidence interval, 0.85-26.3).']","['BACKGROUND', 'METHODS', 'RESULTS']","['Blood Pressure Monitoring, Ambulatory', 'Child', 'Child, Preschool', 'Female', 'Heart Transplantation', 'Humans', 'Hypertension', 'Immunosuppressive Agents', 'Incidence', 'Male', 'Retrospective Studies', 'Risk Factors', 'Severity of Illness Index']",,,,yes,Hypertension after pediatric cardiac transplantation is a common problem and primarily associated with immunosuppressive regimen.,8,MEDICAL,Simple Datatype-Boolean,"Analytical/Evaluative (Convergent Thinking): This merged category is for queries that involve dissecting complex information or data to understand underlying patterns, reasons, or to make informed judgements. Queries in this category seek a deeper understanding that supports decision-making, comparison of options, or evaluating alternatives. The process involves both analysis (to break down and understand) and evaluation (to assess, compare, and decide), acknowledging that these processes often occur in tandem. This category involves queries where the goal is to converge upon a specific answer or decision through analysis and evaluation."
Is pancreaticoduodenectomy with radical lymphadenectomy contraindicated for patients with established chronic liver disease and portal hypertension?,"['Chronic liver disease has been considered a contraindication to radical surgery for intra-abdominal tumors because of the risk of decompensation.', 'In a retrospective analysis of all patients undergoing pancreaticoduodenectomy for cancer treated from January 2000 to December 2006 at our center, 4 patients were identified with operable pancreatic tumors and well-compensated chronic liver disease. The preoperative staging, decompression of the biliary tree, liver biopsy, Child-Turcot-Pugh and MELD scores were described.', 'All patients underwent pancreaticoduodenectomy successfully with minimal blood loss, and no peri-operative blood transfusions or liver decompensation. There was no postoperative mortality. Two patients received adjuvant chemotherapy. One patient died with recurrent disease at 18 months, one is alive with disease recurrence, and two are alive and disease free.']","['BACKGROUND', 'METHODS', 'RESULTS']","['Abdominal Neoplasms', 'Adult', 'Aged', 'Ascites', 'Contraindications', 'Female', 'Hepatitis, Chronic', 'Humans', 'Hypertension, Portal', 'Lymph Node Excision', 'Male', 'Middle Aged', 'Pancreaticoduodenectomy', 'Patient Selection', 'Retrospective Studies', 'Treatment Outcome']",,,,no,Patients with pancreatic cancer and well-compensated chronic liver disease should routinely be considered for radical surgery at specialist hepatobiliary centres with expertise available to manage complex liver disease.,8,MEDICAL,Simple Datatype-Boolean,"Analytical/Evaluative (Convergent Thinking): This merged category is for queries that involve dissecting complex information or data to understand underlying patterns, reasons, or to make informed judgements. Queries in this category seek a deeper understanding that supports decision-making, comparison of options, or evaluating alternatives. The process involves both analysis (to break down and understand) and evaluation (to assess, compare, and decide), acknowledging that these processes often occur in tandem. This category involves queries where the goal is to converge upon a specific answer or decision through analysis and evaluation."
Does prediction of breast cancer prognosis using gene set statistics provide signature stability and biological context?,"['Different microarray studies have compiled gene lists for predicting outcomes of a range of treatments and diseases. These have produced gene lists that have little overlap, indicating that the results from any one study are unstable. It has been suggested that the underlying pathways are essentially identical, and that the expression of gene sets, rather than that of individual genes, may be more informative with respect to prognosis and understanding of the underlying biological process.', 'We sought to examine the stability of prognostic signatures based on gene sets rather than individual genes. We classified breast cancer cases from five microarray studies according to the risk of metastasis, using features derived from predefined gene sets. The expression levels of genes in the sets are aggregated, using what we call a set statistic. The resulting prognostic gene sets were as predictive as the lists of individual genes, but displayed more consistent rankings via bootstrap replications within datasets, produced more stable classifiers across different datasets, and are potentially more interpretable in the biological context since they examine gene expression in the context of their neighbouring genes in the pathway. In addition, we performed this analysis in each breast cancer molecular subtype, based on ER/HER2 status. The prognostic gene sets found in each subtype were consistent with the biology based on previous analysis of individual genes.']","['BACKGROUND', 'RESULTS']","['Biomarkers, Tumor', 'Breast Neoplasms', 'Female', 'Gene Expression Profiling', 'Humans', 'Prognosis']",,,,yes,"To date, most analyses of gene expression data have focused at the level of the individual genes. We show that a complementary approach of examining the data using predefined gene sets can reduce the noise and could provide increased insight into the underlying biological pathways.",8,MEDICAL,Simple Datatype-String,"Analytical/Evaluative (Convergent Thinking): This merged category is for queries that involve dissecting complex information or data to understand underlying patterns, reasons, or to make informed judgements. Queries in this category seek a deeper understanding that supports decision-making, comparison of options, or evaluating alternatives. The process involves both analysis (to break down and understand) and evaluation (to assess, compare, and decide), acknowledging that these processes often occur in tandem. This category involves queries where the goal is to converge upon a specific answer or decision through analysis and evaluation."
Are serum albumin and hemoglobin associated with physical function in community-living older persons in Singapore?,"['Albumin and hemoglobin are viewed as markers of nutritional and inflammatory status. This study examined the associations of serum albumin and hemoglobin with physical function in community-living older adults.', 'Population-based cross-sectional and longitudinal study.', 'The Singapore Longitudinal Aging Studies (SLAS), a community-based study in urban Singapore.', '2762 older adults aged 55 and above assessed at baseline, and 1829 at follow up 1-2 years later.', 'Serum albumin and hemoglobin, Performance Oriented Mobility Assessment (POMA), knee extension strength at baseline, and Instrumental Activities of Daily Living (IADL) at baseline and follow up.', 'In cross-sectional multivariate analyses that adjusted for haemoglobin and other confounders, albumin showed a significant linear association (p<0.001) with POMA balance score (b=0.06, SE=0.02) and knee extension strength (b=0.70, SE=0.10). Independently of albumin, hemoglobin also showed a significant linear association with POMA balance score (b=0.09, SE=0.04). In longitudinal analyses, albumin was significantly associated with IADL decline (IADL total score drop>=1 during follow-up), OR= 0.92 (0.87 - 0.97), p=<0.01.']","['OBJECTIVE', 'METHODS', 'METHODS', 'METHODS', 'METHODS', 'RESULTS']","['Activities of Daily Living', 'Aged', 'Aged, 80 and over', 'Cross-Sectional Studies', 'Female', 'Geriatric Assessment', 'Hemoglobins', 'Humans', 'Knee', 'Longitudinal Studies', 'Male', 'Middle Aged', 'Mobility Limitation', 'Multivariate Analysis', 'Muscle Strength', 'Muscle Weakness', 'Physical Fitness', 'Serum Albumin', 'Singapore']",,,,yes,The findings suggest that low levels of albumin and hemoglobin are potentially useful risk markers of physical functional decline in older adults. Further research should investigate whether improvements in the levels of albumin and hemoglobin alter the level of functional disability and risk of functional decline.,8,MEDICAL,Simple Datatype-Boolean,"Analytical/Evaluative (Convergent Thinking): This merged category is for queries that involve dissecting complex information or data to understand underlying patterns, reasons, or to make informed judgements. Queries in this category seek a deeper understanding that supports decision-making, comparison of options, or evaluating alternatives. The process involves both analysis (to break down and understand) and evaluation (to assess, compare, and decide), acknowledging that these processes often occur in tandem. This category involves queries where the goal is to converge upon a specific answer or decision through analysis and evaluation."
Does pre-treatment neutrophil-to-lymphocyte ratio predict tumor pathology in newly diagnosed renal tumors?,"['The neutrophil-to-lymphocyte ratio (NLR) predicts adverse outcomes after surgical treatment for clear cell renal cell carcinoma (ccRCC). However, its ability to distinguish aggressive from indolent renal tumors remains unknown. We therefore evaluated the association between NLR and pathologic outcomes at nephrectomy.', 'From 1995 to 2008, 2402 patients underwent radical or partial nephrectomy for localized renal tumors. Of these, 2039 had an NLR within 90\xa0days prior to surgery. Comparisons of NLR by tumor size, histologic subtype, and nuclear grade were evaluated.', 'Benign renal masses had a significantly lower NLR than malignant tumors (median 2.92 vs. 3.12; p\xa0=\xa00.037) with the greatest difference noted among renal lesions >7\xa0cm (median 2.79 vs. 3.87; p\xa0<\xa00.001). There was a significant difference in NLR among RCC subtypes (p\xa0=\xa00.002), with cystic ccRCC demonstrating the lowest (median 2.48) and collecting duct RCC the highest NLR (median 5.99). Moreover, there was a significant increase in NLR with larger tumor size and greater nuclear grade (p\xa0<\xa00.001). Specifically, in patients with ccRCC, an incremental increase in tumor size (≤4\xa0cm\xa0=\xa02.80, >4 but ≤7\xa0cm\xa0=\xa03.09 and >7\xa0cm\xa0=\xa03.95) and nuclear grade (G1\xa0=\xa02.68, G2\xa0=\xa02.87, G3\xa0=\xa03.48, and G4\xa0=\xa05.18) was associated with greater NLR (p\xa0<\xa00.001).']","['OBJECTIVE', 'METHODS', 'RESULTS']","['Adult', 'Aged', 'Aged, 80 and over', 'Combined Modality Therapy', 'Female', 'Follow-Up Studies', 'Humans', 'Kidney', 'Kidney Neoplasms', 'Lymphocytes', 'Male', 'Middle Aged', 'Neutrophils', 'Prognosis', 'Retrospective Studies', 'Time Factors', 'Tumor Burden']",,,,yes,"An elevated NLR is associated with RCC pathology, higher-grade tumors, and more aggressive histologic subtypes at the time of nephrectomy. Therefore, NLR appears to be a preoperative marker of biologically aggressive RCC and may be useful in predicting malignancy and guiding management among patients with suspicious renal tumors.",8,MEDICAL,Simple Datatype-Boolean,"Analytical/Evaluative (Convergent Thinking): This merged category is for queries that involve dissecting complex information or data to understand underlying patterns, reasons, or to make informed judgements. Queries in this category seek a deeper understanding that supports decision-making, comparison of options, or evaluating alternatives. The process involves both analysis (to break down and understand) and evaluation (to assess, compare, and decide), acknowledging that these processes often occur in tandem. This category involves queries where the goal is to converge upon a specific answer or decision through analysis and evaluation."
Does pre-measurement rest time affect magnitude and reliability of toe pressure measurements?,"['Toe pressures are used to evaluate lower extremity healing capacity and screen for peripheral arterial disease (PAD). Although toe pressures are commonly used clinically both as an independent measure and in the calculation of the toe-brachial index, the effect of pre-measurement rest duration on the magnitude and reliability of toe pressures is unknown. This study investigated the effect of pre-measurement rest duration on toe pressures.', 'Seventy community-based participants meeting guidelines for PAD screening were recruited. Systolic toe pressures either at the left or right hallux were manually measured using photoplethysmography following 5, 10 and 15 min of rest in a supine horizontal position. Testing was repeated 7-10 days later.', 'A significant drop in toe pressure (3.86 mmHg) occurred between 5 and 10 min (p = 0.001). No significant change occurred between 10 and 15 min. Reliability after 5 min was excellent (intra-class correlation coefficient, ICC = 0.80, 95% CI 0.68-0.89), increasing slightly at 10 and 15 min (ICC = 0.86, 95% CI 0.77-0.92 and ICC = 0.82, 95% CI 0.69-0.89).']","['OBJECTIVE', 'METHODS', 'RESULTS']","['Aged', 'Aged, 80 and over', 'Ankle Brachial Index', 'Blood Pressure', 'Female', 'Humans', 'Male', 'Middle Aged', 'Peripheral Arterial Disease', 'Reproducibility of Results', 'Rest']",,,,yes,Toe pressures stabilize after 10 min of rest in a supine horizontal position. Longer periods of pre-measurement rest did not improve reliability significantly.,0,SCIENCE,Simple Datatype-Boolean,"Analytical/Evaluative (Convergent Thinking): This merged category is for queries that involve dissecting complex information or data to understand underlying patterns, reasons, or to make informed judgements. Queries in this category seek a deeper understanding that supports decision-making, comparison of options, or evaluating alternatives. The process involves both analysis (to break down and understand) and evaluation (to assess, compare, and decide), acknowledging that these processes often occur in tandem. This category involves queries where the goal is to converge upon a specific answer or decision through analysis and evaluation."
Is leptin influenced both by predisposition to obesity and diet composition?,"['(1) To investigate whether plasma leptin concentrations differ between subjects with and without the genetic predisposistion to obesity, and (2) to investigate the effect of dietary manipulations on plasma leptin in these subjects.', ""Fasting and postprandial plasma leptin concentrations were measured before and after 14 days' ad libitum intake of a fat-rich (FAT), starch-rich (STARCH) or sucrose-rich (SUCROSE) diet. On day 15 ad libitum breakfast and lunch were given and blood sampled regularly until 6 p.m."", 'Eight normal-weight, post-obese women and 10 matched controls (body mass index, 23.5+/-0.5 and 22.9 +/- 0.3 kg/m2).', 'Leptin, glucose, insulin, appetite ratings, dietary intake, body weight and composition.', 'Fasting leptin concentration on day 1 or 15 did not differ between post-obese and controls. However, after meal intake leptin increased in post-obese compared with controls on all three diets. In both groups fasting and postprandial leptin concentrations were greater after SUCROSE compared with FAT and STARCH.']","['OBJECTIVE', 'METHODS', 'METHODS', 'METHODS', 'RESULTS']","['Adult', 'Appetite', 'Area Under Curve', 'Blood Glucose', 'Body Composition', 'Body Weight', 'Diet', 'Dietary Carbohydrates', 'Dietary Fats', 'Dietary Sucrose', 'Energy Intake', 'Female', 'Humans', 'Insulin', 'Leptin', 'Obesity', 'Starch', 'Time Factors']",,,,yes,"A larger postprandial leptin concentration was observed in post-obese subjects than in controls. This may be related to greater insulin sensitivity in adipose tissue in the post-obese. Furthermore, increased leptin concentrations were found after a sucrose-rich diet in both groups, possibly related to larger postprandial insulin peaks on this diet. Both contentions should, however, be validated by further studies.",0,SCIENCE,Simple Datatype-Boolean,"Analytical/Evaluative (Convergent Thinking): This merged category is for queries that involve dissecting complex information or data to understand underlying patterns, reasons, or to make informed judgements. Queries in this category seek a deeper understanding that supports decision-making, comparison of options, or evaluating alternatives. The process involves both analysis (to break down and understand) and evaluation (to assess, compare, and decide), acknowledging that these processes often occur in tandem. This category involves queries where the goal is to converge upon a specific answer or decision through analysis and evaluation."
Is long-term administration of intranasal oxytocin a safe and promising therapy for early adolescent boys with autism spectrum disorders?,"['Oxytocin (OT) has been a candidate for the treatment of autism spectrum disorders (ASD), and the impact of intranasally delivered OT on ASD has been investigated. However, most previous studies were conducted by single-dose administration to adults; and, therefore, the long-term effect of nasal OT on ASD patients and its effect on children remain to be clarified.', 'We conducted a singled-armed, open-label study in which OT was administered intranasally over the long term to eight male youth with ASD (10-14 years of age; intelligence quotient [IQ] 20-101). The OT administration was performed in a stepwise increased dosage manner every 2 months (8, 16, 24\u2009IU/dose). A placebo period (1-2 weeks) was inserted before each step. The outcome measures were autism diagnostic observation schedule--generic (ADOS-G), child behavior checklist (CBCL), and the aberrant behavior checklist (ABC). In addition, side effects were monitored by measuring blood pressure and examining urine and blood samples.', 'Six of the eight participants showed improved scores on the communication and social interaction domains of the ADOS-G. However, regarding the T-scores of the CBCL and the scores of the ABC, we could not find any statistically significant improvement, although several subcategories showed a mild tendency for improvement. Caregivers of five of the eight participants reported certain positive effects of the OT therapy, especially on the quality of reciprocal communication. All participants showed excellent compliance and no side effects.']","['OBJECTIVE', 'METHODS', 'RESULTS']","['Administration, Intranasal', 'Adolescent', 'Child', 'Child Development Disorders, Pervasive', 'Dose-Response Relationship, Drug', 'Humans', 'Male', 'Medication Adherence', 'Oxytocin', 'Time Factors', 'Treatment Outcome']",,,,yes,"Although our results on the efficacy of long-term nasal OT therapy still remain controversial, to the best of our knowledge, this is the first report documenting the safety of long-term nasal OT therapy for children with ASD. Even though our data are too preliminary to draw any definite conclusions about efficacy, they do suggest this therapy to be safe, promising, and worthy of a large-scale, double-blind placebo-controlled study.",8,MEDICAL,Simple Datatype-Boolean,"Analytical/Evaluative (Convergent Thinking): This merged category is for queries that involve dissecting complex information or data to understand underlying patterns, reasons, or to make informed judgements. Queries in this category seek a deeper understanding that supports decision-making, comparison of options, or evaluating alternatives. The process involves both analysis (to break down and understand) and evaluation (to assess, compare, and decide), acknowledging that these processes often occur in tandem. This category involves queries where the goal is to converge upon a specific answer or decision through analysis and evaluation."
